{
  "protocol_version": "0.2",
  "fixture_file": "examples.json",
  "semantics": "Applicability is conjunctive over capabilities and requires_profiles, as in the binding corpus. Load the named message from fixture_file, deep-copy it, then apply each replace entry as an RFC 6901 pointer replacement before delivery. A replacement never adds a missing member. deliver_http is an authorized, current canonical HTTP 200 representation whose freshness and Age were validated; deliver_stream is a stream frame and never improves freshness. repair_result and canonical_poll_result are canonical HTTP responses with the generations named by the action. Expected projection descriptors omitted after installation are preserved exactly. Counts are cumulative observability counters. All time advances use a monotonic clock.",
  "vectors": [
    {
      "id": "snapshot_bootstrap",
      "description": "An authorized bootstrap snapshot installs atomically and becomes fresh.",
      "capabilities": ["continuum.snapshot.v0.2"],
      "initial": {
        "security_generation": "g_public_a",
        "data_state": "absent",
        "transport_state": "idle",
        "reconcile_state": "idle"
      },
      "actions": [
        {"op": "deliver_http", "message_ref": "snapshot_10"}
      ],
      "expected": {
        "data_state": "fresh",
        "transport_state": "idle",
        "reconcile_state": "idle",
        "stream_id": "s_example_public_list",
        "cursor": {"epoch": "e_alpha", "sequence": "00000000000000000010"},
        "state_token": "t_state_10",
        "state_digest": "sha256-9vIsxhbsqPA6UZJWWtNz8xysbj3SrXqKYGzffi47df0",
        "state": {
          "entities": {"alpha": {"label": "Alpha", "value": 1}},
          "order": ["alpha"]
        },
        "counts": {"installed": 1}
      }
    },
    {
      "id": "json_patch_exact_base",
      "description": "A JSON Patch applies only over its exact base and advances to its target.",
      "capabilities": ["continuum.snapshot.v0.2", "continuum.patch.json.v0.2"],
      "initial": {
        "security_generation": "g_public_a",
        "data_state": "absent",
        "transport_state": "idle",
        "reconcile_state": "idle"
      },
      "actions": [
        {
          "op": "deliver_http",
          "message_ref": "snapshot_10",
          "representation_etag": "\"snapshot-10-representation\""
        },
        {
          "op": "deliver_http",
          "message_ref": "patch_10_11",
          "representation_etag": "\"patch-10-11-repair\""
        }
      ],
      "expected": {
        "data_state": "fresh",
        "transport_state": "idle",
        "reconcile_state": "idle",
        "stream_id": "s_example_public_list",
        "cursor": {"epoch": "e_alpha", "sequence": "00000000000000000011"},
        "state_token": "t_state_11",
        "state_digest": "sha256-O2MQp3HouvbDPWSm2kQOI0wnLtS0qD8OJIbPRYYQmuw",
        "state": {
          "entities": {"alpha": {"label": "Alpha", "value": 2}},
          "order": ["alpha"]
        },
        "absent_fields": ["/representation_etag"],
        "counts": {"installed": 2}
      }
    },
    {
      "id": "merge_patch_exact_base",
      "description": "A Merge Patch independently requires the exact base and advances atomically.",
      "capabilities": [
        "continuum.snapshot.v0.2",
        "continuum.patch.merge.v0.2"
      ],
      "initial": {
        "security_generation": "g_public_a",
        "data_state": "absent",
        "transport_state": "idle",
        "reconcile_state": "idle"
      },
      "actions": [
        {"op": "deliver_http", "message_ref": "snapshot_10"},
        {
          "op": "deliver_http",
          "message_ref": "merge_patch_11_12",
          "replace": [
            {"path": "/id", "value": "evt_merge_patch_10_11"},
            {"path": "/data/base/cursor/sequence", "value": "00000000000000000010"},
            {"path": "/data/base/state_token", "value": "t_state_10"},
            {
              "path": "/data/base/state_digest",
              "value": "sha256-9vIsxhbsqPA6UZJWWtNz8xysbj3SrXqKYGzffi47df0"
            },
            {"path": "/data/target/cursor/sequence", "value": "00000000000000000011"},
            {"path": "/data/target/state_token", "value": "t_state_11"},
            {
              "path": "/data/target/state_digest",
              "value": "sha256-O2MQp3HouvbDPWSm2kQOI0wnLtS0qD8OJIbPRYYQmuw"
            },
            {"path": "/data/patch/document/entities/alpha/value", "value": 2}
          ]
        }
      ],
      "expected": {
        "data_state": "fresh",
        "transport_state": "idle",
        "reconcile_state": "idle",
        "cursor": {"epoch": "e_alpha", "sequence": "00000000000000000011"},
        "state_token": "t_state_11",
        "state_digest": "sha256-O2MQp3HouvbDPWSm2kQOI0wnLtS0qD8OJIbPRYYQmuw",
        "state": {
          "entities": {"alpha": {"label": "Alpha", "value": 2}},
          "order": ["alpha"]
        },
        "counts": {"installed": 2}
      }
    },
    {
      "id": "patch_duplicate_is_discarded",
      "description": "Re-delivery of a non-idempotent patch is discarded by cursor and token.",
      "capabilities": ["continuum.snapshot.v0.2", "continuum.patch.json.v0.2"],
      "initial": {
        "security_generation": "g_public_a",
        "data_state": "absent",
        "transport_state": "idle",
        "reconcile_state": "idle"
      },
      "actions": [
        {"op": "deliver_http", "message_ref": "snapshot_10"},
        {"op": "deliver_http", "message_ref": "patch_10_11"},
        {"op": "deliver_http", "message_ref": "patch_10_11"}
      ],
      "expected": {
        "data_state": "fresh",
        "transport_state": "idle",
        "reconcile_state": "idle",
        "cursor": {"epoch": "e_alpha", "sequence": "00000000000000000011"},
        "state_token": "t_state_11",
        "state": {
          "entities": {"alpha": {"label": "Alpha", "value": 2}},
          "order": ["alpha"]
        },
        "counts": {"installed": 2, "duplicate": 1}
      }
    },
    {
      "id": "duplicate_does_not_refresh_ttl",
      "description": "A duplicate cannot extend freshness or stale lifetime.",
      "capabilities": ["continuum.snapshot.v0.2"],
      "initial": {
        "security_generation": "g_public_a",
        "data_state": "absent",
        "transport_state": "idle",
        "reconcile_state": "idle"
      },
      "actions": [
        {"op": "deliver_http", "message_ref": "snapshot_10"},
        {"op": "advance_monotonic_ms", "milliseconds": 29000},
        {"op": "deliver_stream", "message_ref": "snapshot_10"},
        {"op": "advance_monotonic_ms", "milliseconds": 1000}
      ],
      "expected": {
        "data_state": "stale_usable",
        "transport_state": "idle",
        "reconcile_state": "repairing",
        "cursor": {"epoch": "e_alpha", "sequence": "00000000000000000010"},
        "state_token": "t_state_10",
        "counts": {"installed": 1, "duplicate": 1, "repair_requests": 1}
      }
    },
    {
      "id": "canonical_http_200_same_tuple_revalidates",
      "description": "The same semantic tuple from a stream is a non-refreshing duplicate, while a current canonical HTTP 200 revalidates it.",
      "capabilities": ["continuum.snapshot.v0.2"],
      "initial": {
        "security_generation": "g_public_a",
        "data_state": "absent",
        "transport_state": "idle",
        "reconcile_state": "idle"
      },
      "actions": [
        {
          "op": "deliver_http",
          "message_ref": "snapshot_10",
          "representation_etag": "\"snapshot-10-representation\""
        },
        {"op": "advance_monotonic_ms", "milliseconds": 30000},
        {"op": "deliver_stream", "message_ref": "snapshot_10"},
        {
          "op": "deliver_http",
          "message_ref": "snapshot_10",
          "representation_etag": "\"snapshot-10-representation\""
        }
      ],
      "expected": {
        "data_state": "fresh",
        "transport_state": "idle",
        "reconcile_state": "idle",
        "cursor": {"epoch": "e_alpha", "sequence": "00000000000000000010"},
        "state_token": "t_state_10",
        "state_digest": "sha256-9vIsxhbsqPA6UZJWWtNz8xysbj3SrXqKYGzffi47df0",
        "representation_etag": "\"snapshot-10-representation\"",
        "counts": {"installed": 1, "duplicate": 1, "repair_requests": 1, "revalidated": 1}
      }
    },
    {
      "id": "authorized_304_renews_freshness",
      "description": "An authorized 304 with complete matching semantic headers is a revalidation, not a duplicate.",
      "capabilities": ["continuum.snapshot.v0.2"],
      "initial": {
        "security_generation": "g_public_a",
        "data_state": "absent",
        "transport_state": "idle",
        "reconcile_state": "idle"
      },
      "actions": [
        {
          "op": "deliver_http",
          "message_ref": "snapshot_10",
          "representation_etag": "\"snapshot-10-representation\""
        },
        {"op": "advance_monotonic_ms", "milliseconds": 30000},
        {
          "op": "validated_not_modified",
          "authorized": true,
          "etag": "\"snapshot-10-representation\"",
          "stream_id": "s_example_public_list",
          "cursor": {"epoch": "e_alpha", "sequence": "00000000000000000010"},
          "state_token": "t_state_10",
          "state_digest": "sha256-9vIsxhbsqPA6UZJWWtNz8xysbj3SrXqKYGzffi47df0",
          "fresh_for_ms": 30000,
          "stale_if_error_ms": 120000,
          "age_ms": 0,
          "captured_security_generation": "g_public_a",
          "captured_repair_generation": 1
        }
      ],
      "expected": {
        "data_state": "fresh",
        "transport_state": "idle",
        "reconcile_state": "idle",
        "cursor": {"epoch": "e_alpha", "sequence": "00000000000000000010"},
        "state_token": "t_state_10",
        "state_digest": "sha256-9vIsxhbsqPA6UZJWWtNz8xysbj3SrXqKYGzffi47df0",